Restraint or Seclusion by gender	Number of Total Students	Percent of Total Students	Number of American Indian or Alaska Native	Percent of American Indian or Alaska Native	Number of Asians	Percent of Asians	Number of Hispanic or Latino of any race	Percent of Hispanic or Latino of any race	Number of Black or African American 	Percent of Black or African American 	Number of Whites	Percent of Whites	Number of Native Hawaiian or Other Pacific Islander	Percent of Native Hawaiian or Other Pacific Islander	Number of Two or more races	Percent of Two or more races	Number of Students With Disabilities Served Only Under Section 504	Percent of Students With Disabilities Served Only Under Section 504	Number of English Language Learners	Percent of English Language Learners	Number of Schools	State_ID	Region_ID	Division_ID
Mechanical restraint on non-IDEA males	0	0	0	0	0	0	0	0	0	0	0	0	0	0	0	0	0	0	0	0	291	44	1	1
Mechanical restraint on non-IDEA females	0	0	0	0	0	0	0	0	0	0	0	0	0	0	0	0	0	0	0	0	291	44	1	1
Mechanical restraint total	0	0	0	0	0	0	0	0	0	0	0	0	0	0	0	0	0	0	0	0	291	44	1	1
Physical restraint on non-IDEA males	70	70	DS	DS	0	0	18	18	10	10	36	36	DS	DS	DS	DS	DS	DS	0	0	291	44	1	1
Physical restraint on non-IDEA females	30	30	0	0	0	0	5	5	6	6	19	19	0	0	0	0	DS	DS	0	0	291	44	1	1
Physical restraint total	100	100	DS	DS	0	0	23	23	16	16	55	55	DS	DS	DS	DS	4	4	0	0	291	44	1	1
Seclusion on non-IDEA males	DS	100	0	0	0	0	DS	100	0	0	0	0	0	0	0	0	DS	100	0	0	291	44	1	1
Seclusion on non-IDEA females	0	0	0	0	0	0	0	0	0	0	0	0	0	0	0	0	0	0	0	0	291	44	1	1
Seclusion total	DS	100	0	0	0	0	DS	100	0	0	0	0	0	0	0	0	DS	100	0	0	291	44	1	1
