Restraint or Seclusion by gender	Number of Total Students	Percent of Total Students	Number of American Indian or Alaska Native	Percent of American Indian or Alaska Native	Number of Asians	Percent of Asians	Number of Hispanic or Latino of any race	Percent of Hispanic or Latino of any race	Number of Black or African American	Percent of Black or African American	Number of Whites	Percent of Whites	Number of Native Hawaiian or Other Pacific Islander	Percent of Native Hawaiian or Other Pacific Islander	Number of Two or more races	Percent of Two or more races	Number of English Language Learners	Percent of English Language Learners	Number of Schools	State_ID	Region_ID	Division_ID
Mechanical restraint on males with disabilities under IDEA	66	79.5	0	0	DS	2.4	DS	2.4	4	4.8	56	67.5	0	0	DS	2.4	0	0	"1,875"	18	2	3
Mechanical restraint on females with disabilities under IDEA	17	20.5	0	0	0	0	0	0	DS	2.4	15	18.1	0	0	0	0	0	0	"1,875"	18	2	3
Mechanical restraint total	83	100	0	0	DS	2.4	DS	2.4	6	7.2	71	85.5	0	0	DS	2.4	0	0	"1,875"	18	2	3
Physical restraint on males with disabilities under IDEA	841	85.9	DS	0.2	7	0.7	22	2.2	120	12.3	653	66.7	DS	0.2	35	3.6	DS	0.2	"1,875"	18	2	3
Physical restraint on females with disabilities under IDEA	138	14.1	DS	0.2	DS	0.2	DS	0.2	13	1.3	114	11.6	0	0	5	0.5	0	0	"1,875"	18	2	3
Physical restraint total	979	100	4	0.4	9	0.9	24	2.5	133	13.6	767	78.3	DS	0.2	40	4.1	DS	0.2	"1,875"	18	2	3
Seclusion on males with disabilities under IDEA	884	85.7	DS	0.2	7	0.7	22	2.1	173	16.8	643	62.4	DS	0.2	35	3.4	4	0.4	"1,875"	18	2	3
Seclusion on females with disabilities under IDEA	147	14.3	0	0	DS	0.2	DS	0.2	25	2.4	112	10.9	DS	0.2	4	0.4	DS	0.2	"1,875"	18	2	3
Seclusion total	"1,031"	100	DS	0.2	9	0.9	24	2.3	198	19.2	755	73.2	4	0.4	39	3.8	6	0.6	"1,875"	18	2	3
