Restraint or Seclusion by gender	Number of Total Students	Percent of Total Students	Number of American Indian or Alaska Native	Percent of American Indian or Alaska Native	Number of Asians	Percent of Asians	Number of Hispanic or Latino of any race	Percent of Hispanic or Latino of any race	Number of Black or African American 	Percent of Black or African American 	Number of Whites	Percent of Whites	Number of Native Hawaiian or Other Pacific Islander	Percent of Native Hawaiian or Other Pacific Islander	Number of Two or more races	Percent of Two or more races	Number of English Language Learners	Percent of English Language Learners	Number of Schools	State_ID	Region_ID	Division_ID
Mechanical restraint on males with disabilities under IDEA	6	75	DS	25	0	0	0	0	0	0	4	50	0	0	0	0	0	0	781	30	4	8
Mechanical restraint on females with disabilities under IDEA	DS	25	0	0	0	0	0	0	0	0	DS	25	0	0	0	0	0	0	781	30	4	8
Mechanical restraint total	8	100	DS	25	0	0	0	0	0	0	6	75	0	0	0	0	0	0	781	30	4	8
Physical restraint on males with disabilities under IDEA	67	75.3	10	11.2	0	0	DS	2.2	DS	2.2	51	57.3	0	0	DS	2.2	0	0	781	30	4	8
Physical restraint on females with disabilities under IDEA	22	24.7	DS	2.2	0	0	DS	2.2	DS	2.2	16	18	0	0	0	0	0	0	781	30	4	8
Physical restraint total	89	100	12	13.5	0	0	4	4.5	4	4.5	67	75.3	0	0	DS	2.2	0	0	781	30	4	8
Seclusion on males with disabilities under IDEA	44	80	5	9.1	0	0	DS	3.6	0	0	35	63.6	0	0	DS	3.6	0	0	781	30	4	8
Seclusion on females with disabilities under IDEA	11	20	0	0	0	0	DS	3.6	0	0	9	16.4	0	0	0	0	0	0	781	30	4	8
Seclusion total	55	100	5	9.1	0	0	4	7.3	0	0	44	80	0	0	DS	3.6	0	0	781	30	4	8
