Discipline by gender	Total Students	Total Percent	Number of American Indian or Alaska Native	Percent of American Indian or Alaska Native	Number of Asians	Percent of Asians	Number of Hispanic or Latino of any race	Percent of Hispanic or Latino of any race	Number of Black or African American	Percent of Black or African American	Number of Whites	Percent of Whites	Number of Native Hawaiian or Other Pacific Islander	Percent of Native Hawaiian or Other Pacific Islander	Number of Two or more races	Percent of Two or more races	Number of Students With Disabilities Served Under IDEA	Percent of Students With Disabilities Served Under IDEA	Number of Students With Disabilities Served Only Under Section 504	Percent of Students With Disabilities Served Only Under Section 504	Number of English Language Learners	Percent of English Language Learners	Number of Schools	State_ID	Region_ID	Division_ID
Males subjected to mechanical restraint	0	0	0	0	0	0	0	0	0	0	0	0	0	0	0	0	0	0	0	0	0	0	493	2	4	9
Females subjected to mechanical restraint	0	0	0	0	0	0	0	0	0	0	0	0	0	0	0	0	0	0	0	0	0	0	493	2	4	9
Total students subjected to mechanical restraint	0	0	0	0	0	0	0	0	0	0	0	0	0	0	0	0	0	0	0	0	0	0	493	2	4	9
Males subjected to physical restraint	100	90.9	40	36.4	0	0	DS	1.8	4	3.6	48	43.6	DS	1.8	4	3.6	77	70	0	0	4	3.6	493	2	4	9
Females subjected to physical restraint	10	9.1	4	3.6	0	0	0	0	0	0	6	5.5	0	0	0	0	6	5.5	0	0	0	0	493	2	4	9
Total students subjected to physical restraint	110	100	44	40	0	0	DS	1.8	4	3.6	54	49.1	DS	1.8	4	3.6	83	75.5	0	0	4	3.6	493	2	4	9
Males subjected to seclusion	37	90.2	10	24.4	0	0	0	0	DS	4.9	19	46.3	DS	4.9	4	9.8	35	85.4	0	0	0	0	493	2	4	9
Females subjected to seclusion	4	9.8	DS	4.9	0	0	0	0	0	0	DS	4.9	0	0	0	0	4	9.8	0	0	DS	4.9	493	2	4	9
Total students subjected to seclusion	41	100	12	29.3	0	0	0	0	DS	4.9	21	51.2	DS	4.9	4	9.8	39	95.1	0	0	DS	4.9	493	2	4	9
