Restraint or Seclusion by gender	Number of Total Students	Percent of Total Students	Number of American Indian or Alaska Native	Percent of American Indian or Alaska Native	Number of Asians	Percent of Asians	Number of Hispanic or Latino of any race	Percent of Hispanic or Latino of any race	Number of Black or African American 	Percent of Black or African American 	Number of Whites	Percent of Whites	Number of Native Hawaiian or Other Pacific Islander	Percent of Native Hawaiian or Other Pacific Islander	Number of Two or more races	Percent of Two or more races	Number of English Language Learners	Percent of English Language Learners	Number of Schools	State_ID	Region_ID	Division_ID
Mechanical restraint on males with disabilities under IDEA	42	84	0	0	0	0	DS	4	31	62	9	18	0	0	0	0	DS	4	"1,219"	45	3	5
Mechanical restraint on females with disabilities under IDEA	8	16	0	0	0	0	0	0	6	12	DS	4	0	0	0	0	0	0	"1,219"	45	3	5
Mechanical restraint total	50	100	0	0	0	0	DS	4	37	74	11	22	0	0	0	0	DS	4	"1,219"	45	3	5
Physical restraint on males with disabilities under IDEA	362	82.3	0	0	DS	0.5	10	2.3	175	39.8	166	37.7	0	0	9	2	4	0.9	"1,219"	45	3	5
Physical restraint on females with disabilities under IDEA	78	17.7	0	0	DS	0.5	DS	0.5	37	8.4	35	8	0	0	DS	0.5	0	0	"1,219"	45	3	5
Physical restraint total	440	100	0	0	4	0.9	12	2.7	212	48.2	201	45.7	0	0	11	2.5	4	0.9	"1,219"	45	3	5
Seclusion on males with disabilities under IDEA	187	85	0	0	DS	0.9	6	2.7	78	35.5	95	43.2	0	0	6	2.7	DS	0.9	"1,219"	45	3	5
Seclusion on females with disabilities under IDEA	33	15	0	0	0	0	0	0	13	5.9	16	7.3	DS	0.9	DS	0.9	0	0	"1,219"	45	3	5
Seclusion total	220	100	0	0	DS	0.9	6	2.7	91	41.4	111	50.5	DS	0.9	8	3.6	DS	0.9	"1,219"	45	3	5
