Restraint or Seclusion by gender	Number of Total Students	Percent of Total Students	Number of American Indian or Alaska Native	Percent of American Indian or Alaska Native	Number of Asians	Percent of Asians	Number of Hispanic or Latino of any race	Percent of Hispanic or Latino of any race	Number of Black or African Americans	Percent of Black or African Americans 	Number of Whites	Percent of Whites	Number of Native Hawaiian or Other Pacific Islander	Percent of Native Hawaiian or Other Pacific Islander	Number of Two or more races	Percent of Two or more races	Number of Students With Disabilities Served Only Under Section 504	Percent of Students With Disabilities Served Only Under Section 504	Number of English Language Learners	Percent of English Language Learners	Number of Schools	State_ID	Region_ID	Division_ID
Mechanical restraint on males with disabilities under IDEA	361	50	0	0	0	0	6	0.8	304	42.1	41	5.7	5	0.7	5	0.7	10	1.4	5	0.7	"2,077"	27	2	4
Mechanical restraint on females with disabilities under IDEA	361	50	9	1.2	0	0	17	2.4	300	41.6	20	2.8	10	1.4	5	0.7	5	0.7	5	0.7	"2,077"	27	2	4
Mechanical restraint total	722	100	9	1.2	0	0	23	3.2	604	83.7	61	8.4	15	2.1	10	1.4	15	2.1	10	1.4	"2,077"	27	2	4
Physical restraint on males with disabilities under IDEA	442	52.8	DS	0.2	DS	0.2	12	1.4	332	39.7	81	9.7	5	0.6	8	1	10	1.2	10	1.2	"2,077"	27	2	4
Physical restraint on females with disabilities under IDEA	395	47.2	13	1.6	DS	0.2	17	2	311	37.2	36	4.3	10	1.2	6	0.7	5	0.6	6	0.7	"2,077"	27	2	4
Physical restraint total	837	100	15	1.8	4	0.5	29	3.5	643	76.8	117	14	15	1.8	14	1.7	15	1.8	16	1.9	"2,077"	27	2	4
Seclusion on males with disabilities under IDEA	51	78.5	4	6.2	0	0	4	6.2	7	10.8	34	52.3	0	0	DS	3.1	DS	3.1	5	7.7	"2,077"	27	2	4
Seclusion on females with disabilities under IDEA	14	21.5	0	0	0	0	0	0	DS	3.1	12	18.5	0	0	0	0	0	0	DS	3.1	"2,077"	27	2	4
Seclusion total	65	100	4	6.2	0	0	4	6.2	9	13.8	46	70.8	0	0	DS	3.1	DS	3.1	7	10.8	"2,077"	27	2	4
