Restraint or Seclusion by gender	Number of Total Students	Percent of Total Students	Number of American Indian or Alaska Native	Percent of American Indian or Alaska Native	Number of Asians	Percent of Asians	Number of Hispanic or Latino of any race	Percent of Hispanic or Latino of any race 	Number of Black or African American 	Percent of Black or African American 	Number of Whites	Percent of Whites	Number of Native Hawaiian or Other Pacific Islander 	Percent of Native Hawaiian or Other Pacific Islander	Number of Two or more races	Percent of Two or more races	Number of Students With Disabilities Served Only Under Section 504	Percent of Students With Disabilities Served Only Under Section 504	Number of English Language Learners	Percent of English Language Learners	Number of Schools	State_ID	Region_ID	Division_ID
Mechanical restraint on non-IDEA males	0	0	0	0	0	0	0	0	0	0	0	0	0	0	0	0	0	0	0	0	668	46	2	4
Mechanical restraint on non-IDEA females	0	0	0	0	0	0	0	0	0	0	0	0	0	0	0	0	0	0	0	0	668	46	2	4
Mechanical restraint total	0	0	0	0	0	0	0	0	0	0	0	0	0	0	0	0	0	0	0	0	668	46	2	4
Physical restraint on non-IDEA males	75	72.8	21	20.4	DS	1.9	DS	1.9	6	5.8	42	40.8	0	0	DS	1.9	0	0	DS	1.9	668	46	2	4
Physical restraint on non-IDEA females	28	27.2	13	12.6	0	0	DS	1.9	DS	1.9	11	10.7	0	0	0	0	0	0	0	0	668	46	2	4
Physical restraint total	103	100	34	33	DS	1.9	4	3.9	8	7.8	53	51.5	0	0	DS	1.9	0	0	DS	1.9	668	46	2	4
Seclusion on non-IDEA males	39	84.8	DS	4.3	0	0	DS	4.3	0	0	35	76.1	0	0	0	0	DS	4.3	DS	4.3	668	46	2	4
Seclusion on non-IDEA females	7	15.2	DS	4.3	0	0	0	0	0	0	5	10.9	0	0	0	0	0	0	0	0	668	46	2	4
Seclusion total	46	100	4	8.7	0	0	DS	4.3	0	0	40	87	0	0	0	0	DS	4.3	DS	4.3	668	46	2	4
