Restraint or Seclusion by gender	Number of Total Students	Percent of Total Students	Number of American Indian or Alaska Native	Percent of American Indian or Alaska Native	Number of Asians	Percent of Asians	Number of Hispanic or Latino of any race	Percent of Hispanic or Latino of any race	Number of Black or African American	Percent of Black or African American	Number of Whites	Percent of Whites	Number of Native Hawaiian or Other Pacific Islander	Percent of Native Hawaiian or Other Pacific Islander	Number of Two or more races	Percent of Two or more races	Number of English Language Learners	Percent of English Language Learners	Number of Schools	State_ID	Region_ID	Division_ID
Mechanical restraint on males with disablities under IDEA	8	80	0	0	0	0	0	0	0	0	8	80	0	0	0	0	0	0	595	23	1	1
Mechanical restraint on females with disablities under IDEA	DS	20	0	0	0	0	0	0	0	0	DS	20	0	0	0	0	0	0	595	23	1	1
Mechanical restraint total	10	100	0	0	0	0	0	0	0	0	10	100	0	0	0	0	0	0	595	23	1	1
Physical restraint on males with disabilities under IDEA	393	80	DS	0.4	DS	0.4	DS	0.4	16	3.3	365	74.3	0	0	6	1.2	4	0.8	595	23	1	1
Physical restraint on females with disabilities under IDEA	98	20	0	0	0	0	DS	0.4	DS	0.4	92	18.7	0	0	DS	0.4	0	0	595	23	1	1
Physical restraint total	491	100	DS	0.4	DS	0.4	4	0.8	18	3.7	457	93.1	0	0	8	1.6	4	0.8	595	23	1	1
Seclusion on males with disabilities under IDEA	157	79.3	0	0	DS	1	DS	1	DS	1	151	76.3	0	0	0	0	DS	1	595	23	1	1
Seclusion on females with disabilities under IDEA	41	20.7	0	0	0	0	DS	1	DS	1	37	18.7	0	0	0	0	0	0	595	23	1	1
Seclusion total	198	100	0	0	DS	1	4	2	4	2	188	94.9	0	0	0	0	DS	1	595	23	1	1
