Restraint or Seclusion by gender	Number of Total Students	Percent of Total Students	Number of American Indian or Alaska Native	Percent of American Indian or Alaska Native	Number of Asians	Percent of Asians	Number of Hispanic or Latino of any race	Percent of Hispanic or Latino of any race 	Number of Black or African American 	Percent of Black or African American 	Number of Whites	Percent of Whites	Number of Native Hawaiian or Other Pacific Islander	Percent of Native Hawaiian or Other Pacific Islander	Number of Two or more races	Percent of Two or more races	Number of English Language Learners	Percent of English Language Learners	Number of Schools	State_ID	Region_ID	Division_ID
Mechanical restraint on males with disabilities under IDEA	52	71.2	0	0	0	0	0	0	10	13.7	42	57.5	0	0	0	0	DS	2.7	"1,802"	47	3	6
Mechanical restraint on females with disabilities under IDEA	21	28.8	0	0	0	0	DS	2.7	DS	2.7	17	23.3	0	0	0	0	DS	2.7	"1,802"	47	3	6
Mechanical restraint total	73	100	0	0	0	0	DS	2.7	12	16.4	59	80.8	0	0	0	0	4	5.5	"1,802"	47	3	6
Physical restraint on males with disabilities under IDEA	619	86	DS	0.3	DS	0.3	7	1	132	18.3	474	65.8	0	0	DS	0.3	DS	0.3	"1,802"	47	3	6
Physical restraint on females with disabilities under IDEA	101	14	0	0	DS	0.3	4	0.6	27	3.8	66	9.2	0	0	DS	0.3	DS	0.3	"1,802"	47	3	6
Physical restraint total	720	100	DS	0.3	4	0.6	11	1.5	159	22.1	540	75	0	0	4	0.6	4	0.6	"1,802"	47	3	6
Seclusion on males with disabilities under IDEA	244	81.3	0	0	0	0	6	DS	63	21	175	58.3	0	0	0	0	0	0	"1,802"	47	3	6
Seclusion on females with disabilities under IDEA	56	18.7	0	0	0	0	DS	0.7	17	5.7	35	11.7	0	0	DS	0.7	0	0	"1,802"	47	3	6
Seclusion total	300	100	0	0	0	0	8	2.7	80	26.7	210	70	0	0	DS	0.7	0	0	"1,802"	47	3	6
