Restraint or Seclusion by gender	Number of Total Students	Percent of Total Students	Number of American Indian or Alaska Native 	Percent of American Indian or Alaska Native 	Number of Asians	Percent of Asians	Number of Hispanic or Latino of any race 	Percent of Hispanic or Latino of any race	Number of Black or African American 	Percent of Black or African American 	Number of Whites	Percent of Whites	Number of Native Hawaiian or Other Pacific Islander	Percent of Native Hawaiian or Other Pacific Islande	Number of Two or more races	Percent of Two or more races	Number of Students With Disabilities Served Only Under Section 504	Percent of Students With Disabilities Served Only Under Section 504	Number of English Language Learners	Percent of English Language Learners	Number of Schools	State_ID	Region_ID	Division_ID
Mechanical restraint on non-IDEA males	117	95.1	0	0	0	0	29	23.6	81	65.9	7	5.7	0	r	0	0	0	0	0	0	"2,538"	34	1	2
Mechanical restraint on non-IDEA females	6	4.9	0	0	0	0	DS	1.6	4	3.3	0	0	0	0	0	0	0	0	0	0	"2,538"	34	1	2
Mechanical restraint total	123	100	0	0	0	0	31	25.2	85	69.1	7	5.7	0	0	0	0	0	0	0	0	"2,538"	34	1	2
Physical restraint on non-IDEA males	134	77.5	0	0	DS	1.2	14	8.1	70	40.5	44	25.4	0	0	4	2.3	9	5.2	0	0	"2,538"	34	1	2
Physical restraint on non-IDEA females	39	22.5	0	0	DS	1.2	DS	1.2	27	15.6	8	4.6	0	0	0	0	4	2.3	0	0	"2,538"	34	1	2
Physical restraint total	173	100	0	0	4	2.3	16	9.2	97	56.1	52	30.1	0	0	4	2.3	13	7.5	0	0	"2,538"	34	1	2
Seclusion on non-IDEA males	126	94.7	0	0	0	0	28	21.1	83	62.4	13	9.8	0	0	DS	1.5	0	0	0	0	"2,538"	34	1	2
Seclusion on non-IDEA females	7	5.3	0	0	0	0	DS	1.5	5	3.8	0	0	0	0	0	0	0	0	0	0	"2,538"	34	1	2
Seclusion total	133	100	0	0	0	0	30	22.6	88	66.2	13	9.8	0	0	DS	1.5	0	0	0	0	"2,538"	34	1	2
