Restraint or Seclusion by gender	Number of Total Students	Percent of Total Students	Number of American Indian or Alaska Native	Percent of American Indian or Alaska Native 	Number of Asians 	Percent of Asians 	Number of Hispanic or Latino of any race	Percent of Hispanic or Latino of any race 	Number of Black or African American 	Percent of Black or African American 	Number of Whites	Percent of Whites	Number of Native Hawaiian or Other Pacific Islander	Percent of Native Hawaiian or Other Pacific Islander	Number of Two or more races	Percent of Two or more races	Number of Students With Disabilities Served Only Under Section 504	Percent of Students With Disabilities Served Only Under Section 504	Number of English Language Learners	Percent of English Language Learners	Number of Schools	State_ID	Region_ID	Division_ID
Mechanical restraint on non-IDEA males	20	100	DS	10	0	0	6	30	5	25	5	25	0	0	DS	10	0	0	0	0	649	32	4	8
Mechanical restraint on non-IDEA females	0	0	0	0	0	0	0	0	0	0	0	0	0	0	0	0	0	0	0	0	649	32	4	8
Mechanical restraint total	20	100	DS	10	0	0	6	30	5	25	5	25	0	0	DS	10	0	0	0	0	649	32	4	8
Physical restraint on non-IDEA males	26	86.7	DS	6.7	0	0	8	26.7	8	26.7	8	26.7	0	0	0	0	DS	6.7	0	0	649	32	4	8
Physical restraint on non-IDEA females	4	13.3	0	0	0	0	DS	6.7	DS	6.7	0	0	0	0	0	0	0	0	0	0	649	32	4	8
Physical restraint total	30	100	DS	6.7	0	0	10	33.3	10	33.3	8	26.7	0	0	0	0	DS	6.7	0	0	649	32	4	8
Seclusion on non-IDEA males	27	100	0	0	0	0	11	40.7	11	40.7	5	18.5	0	0	0	0	0	0	0	0	649	32	4	8
Seclusion on non-IDEA females	0	0	0	0	0	0	0	0	0	0	0	0	0	0	0	0	0	0	0	0	649	32	4	8
Seclusion total	27	100	0	0	0	0	11	40.7	11	40.7	5	18.5	0	0	0	0	0	0	0	0	649	32	4	8
