Restraint or Seclusion by gender	Number of Total Students 	Percent of Total Students 	Number of American Indian or Alaska Native 	Percent of American Indian or Alaska Native 	Number of Asians 	Percent of Asians	Number of Hispanic or Latino of any race 	Percent of Hispanic or Latino of any race 	Number of Black or African American 	Percent of Black or African American 	Number of Whites 	Percent of Whites 	Number of Native Hawaiian or Other Pacific Islander	Percent of Native Hawaiian or Other Pacific Islander	Number of Two or more races 	Percent of Two or more races	Number of Students With Disabilities Served Only Under Section 504	Percent of Students With Disabilities Served Only Under Section 504	Number of English Language Learners	Percent of English Language Learners	Number of Schools	State_ID	Region_ID	Division_ID
Mechanical restraint on non-IDEA males	0	0	0	0	0	0	0	0	0	0	0	0	0	0	0	0	0	0	0	0	468	38	2	4
Mechanical restraint on non-IDEA females	DS	100	0	0	0	0	0	0	0	0	DS	100	0	0	0	0	0	0	0	0	468	38	2	4
Mechanical restraint total	DS	100	0	0	0	0	0	0	0	0	DS	100	0	0	0	0	0	0	0	0	468	38	2	4
Physical restraint on non-IDEA males	19	82.6	0	0	0	0	0	0	DS	8.7	17	73.9	0	0	0	0	DS	8.7	0	0	468	38	2	4
Physical restraint on non-IDEA females	4	17.4	DS	8.7	0	0	0	0	0	0	0	0	0	0	DS	8.7	0	0	0	0	468	38	2	4
Physical restraint total	23	100	DS	8.7	0	0	0	0	DS	8.7	17	73.9	0	0	DS	8.7	DS	8.7	0	0	468	38	2	4
Seclusion on non-IDEA males	27	67.5	DS	5	0	0	DS	5	DS	5	21	52.5	0	0	0	0	0	0	0	0	468	38	2	4
Seclusion on non-IDEA females	13	32.5	DS	5	0	0	0	0	DS	5	9	22.5	0	0	0	0	0	0	0	0	468	38	2	4
Seclusion total	40	100	4	10	0	0	DS	5	4	10	30	75	0	0	0	0	0	0	0	0	468	38	2	4
