Restraint or Seclusion by gender	Number of Total Students	Percent of Total Students	Number of American Indian or Alaska Native	Percent of American Indian or Alaska Native	Number of Asians	Percent of Asians	Number of Hispanic or Latino of any race	Percent of Hispanic or Latino of any race	Number of Black or African American	Percent of Black or African American	Number of Whites	Percent of Whites	Number of Native Hawaiian or Other Pacific Islander	Percent of Native Hawaiian or Other Pacific Islander	Number of Two or more races	Percent of Two or more races	Number of English Language Learners	Percent of English Language Learners	Number of Schools	State_ID	Region_ID	Division_ID
Mechanical restraint on males with disabilities under IDEA	87	78.4	DS	1.8	0	0	5	4.5	7	6.3	69	62.2	DS	1.8	DS	1.8	0	0	"2,242"	55	2	3
Mechanical restraint on females with disabilities under IDEA	24	21.6	DS	1.8	0	0	0	0	DS	1.8	20	18	0	0	0	0	0	0	"2,242"	55	2	3
Mechanical restraint total	111	100	4	3.6	0	0	5	4.5	9	8.1	89	80.2	DS	1.8	DS	1.8	0	0	"2,242"	55	2	3
Physical restraint on males with disabilities under IDEA	"1,130"	84.6	28	2.1	18	1.3	44	3.3	149	11.2	854	63.9	0	0	37	2.8	11	0.8	"2,242"	55	2	3
Physical restraint on females with disabilities under IDEA	206	15.4	10	0.7	DS	0.1	5	0.4	35	2.6	152	11.4	0	0	DS	0.1	DS	0.1	"2,242"	55	2	3
Physical restraint total	"1,336"	100	38	2.8	20	1.5	49	3.7	184	13.8	"1,006"	75.3	0	0	39	2.9	13	1	"2,242"	55	2	3
Seclusion on males with disabilities under IDEA	"1,112"	83.7	22	1.7	16	1.2	44	3.3	124	9.3	881	66.3	0	0	25	1.9	8	0.6	"2,242"	55	2	3
Seclusion on females with disabilities under IDEA	217	16.3	7	0.5	0	0	6	0.5	37	2.8	162	12.2	0	0	5	0.4	DS	0.2	"2,242"	55	2	3
Seclusion total	"1,329"	100	29	2.2	16	1.2	50	3.8	161	12.1	"1,043"	78.5	0	0	30	2.3	10	0.8	"2,242"	55	2	3
